{
    "$schema": "http://json-schema.org/draft-07/schema#",
    "title": "Theme",
    "type": "object",
    "properties": {
        "name": {
            "type": "string"
        },
        "author": {
            "type": "string"
        },
        "author-url": {
            "type": "string"
        },
        "description": {
            "type": "string"
        },
        "license": {
            "type": "string"
        },
        "website": {
            "type": "string"
        }
    },
    "required": [
        "name",
        "author",
        "description",
        "license"
    ]
}